{
  "id": "local.checkin",
  "name": "城市应急巡检台",
  "version": "1.0.0",
  "description": "面向外勤应急巡检的任务台，同时覆盖验证 AppRuntime native bridge 全量能力。",
  "icon": "巡",
  "entry": "index.html",
  "permissions": [
    "storage",
    "secureStorage",
    "notification",
    "network",
    "device",
    "ui",
    "clipboard",
    "share",
    "open",
    "file",
    "media",
    "location",
    "haptics",
    "barcode",
    "audio",
    "biometric",
    "contacts",
    "calendar",
    "download",
    "events"
  ],
  "createdAt": "2026-05-07T00:00:00Z",
  "runtimeVersion": "1.0",
  "networkAllowlist": ["example.com"],
  "signature": null
}
